{
  "$schema": "../schema/omslagpunten.schema.json",
  "versie": 1,
  "gegenereerdOp": "2026-09-30T17:47:24.531Z",
  "valuta": "EUR",
  "btw": "inclusief",
  "uitleg": "Alleen het deel dat per leverancier verschilt: vaste kosten x 12 + verbruik x inkoopopslag - teruglevering x terugleverCorrectie, incl. btw. Omslagpunten zijn in kWh (stroom, teruglevering) of m3 (gas) per jaar.",
  "stroom": {
    "aantalLeveranciers": 21,
    "vastPerJaar": {
      "min": 71.87,
      "max": 102.85
    },
    "opslag": {
      "min": 0.01,
      "max": 0.02528
    },
    "omslagpunt": 2027,
    "goedkoopstePerVerbruik": [
      {
        "vanaf": 0,
        "tot": 3,
        "id": "energiek",
        "naam": "Energiek"
      },
      {
        "vanaf": 3,
        "tot": 625,
        "id": "vattenfall",
        "naam": "Vattenfall (FlexPrijs)"
      },
      {
        "vanaf": 625,
        "tot": null,
        "id": "powerpeers",
        "naam": "Powerpeers"
      }
    ],
    "paren": [
      {
        "lageVasteKosten": "energiek",
        "lageOpslag": "vattenfall",
        "omslagpunt": 3
      },
      {
        "lageVasteKosten": "energiek",
        "lageOpslag": "budget",
        "omslagpunt": 8
      },
      {
        "lageVasteKosten": "vandebron",
        "lageOpslag": "frank",
        "omslagpunt": 15
      },
      {
        "lageVasteKosten": "essent",
        "lageOpslag": "energyzero",
        "omslagpunt": 42
      },
      {
        "lageVasteKosten": "essent",
        "lageOpslag": "greenchoice",
        "omslagpunt": 42
      },
      {
        "lageVasteKosten": "energiedirect",
        "lageOpslag": "frank",
        "omslagpunt": 51
      },
      {
        "lageVasteKosten": "liveenergy",
        "lageOpslag": "powerpeers",
        "omslagpunt": 169
      },
      {
        "lageVasteKosten": "vandebron",
        "lageOpslag": "easyenergy",
        "omslagpunt": 200
      },
      {
        "lageVasteKosten": "nextenergy",
        "lageOpslag": "pure",
        "omslagpunt": 239
      },
      {
        "lageVasteKosten": "nextenergy",
        "lageOpslag": "mega",
        "omslagpunt": 253
      },
      {
        "lageVasteKosten": "nextenergy",
        "lageOpslag": "powerpeers",
        "omslagpunt": 284
      },
      {
        "lageVasteKosten": "mega",
        "lageOpslag": "powerpeers",
        "omslagpunt": 294
      },
      {
        "lageVasteKosten": "pure",
        "lageOpslag": "powerpeers",
        "omslagpunt": 300
      },
      {
        "lageVasteKosten": "energiek",
        "lageOpslag": "powerpeers",
        "omslagpunt": 390
      },
      {
        "lageVasteKosten": "budget",
        "lageOpslag": "powerpeers",
        "omslagpunt": 457
      },
      {
        "lageVasteKosten": "liveenergy",
        "lageOpslag": "zonneplan",
        "omslagpunt": 571
      },
      {
        "lageVasteKosten": "vattenfall",
        "lageOpslag": "powerpeers",
        "omslagpunt": 625
      },
      {
        "lageVasteKosten": "essent",
        "lageOpslag": "zonopnaam",
        "omslagpunt": 1150
      },
      {
        "lageVasteKosten": "essent",
        "lageOpslag": "anwb",
        "omslagpunt": 1698
      },
      {
        "lageVasteKosten": "liveenergy",
        "lageOpslag": "tibber",
        "omslagpunt": 1819
      },
      {
        "lageVasteKosten": "liveenergy",
        "lageOpslag": "frank",
        "omslagpunt": 1884
      },
      {
        "lageVasteKosten": "energyzero",
        "lageOpslag": "zonopnaam",
        "omslagpunt": 2440
      },
      {
        "lageVasteKosten": "greenchoice",
        "lageOpslag": "zonopnaam",
        "omslagpunt": 2440
      },
      {
        "lageVasteKosten": "energyzero",
        "lageOpslag": "anwb",
        "omslagpunt": 2769
      },
      {
        "lageVasteKosten": "greenchoice",
        "lageOpslag": "anwb",
        "omslagpunt": 2769
      },
      {
        "lageVasteKosten": "liveenergy",
        "lageOpslag": "energiedirect",
        "omslagpunt": 3049
      },
      {
        "lageVasteKosten": "nextenergy",
        "lageOpslag": "zonneplan",
        "omslagpunt": 3120
      },
      {
        "lageVasteKosten": "zonopnaam",
        "lageOpslag": "anwb",
        "omslagpunt": 3181
      },
      {
        "lageVasteKosten": "eneco",
        "lageOpslag": "anwb",
        "omslagpunt": 3670
      },
      {
        "lageVasteKosten": "eneco",
        "lageOpslag": "zonopnaam",
        "omslagpunt": 3990
      },
      {
        "lageVasteKosten": "nextenergy",
        "lageOpslag": "tibber",
        "omslagpunt": 4000
      },
      {
        "lageVasteKosten": "nextenergy",
        "lageOpslag": "frank",
        "omslagpunt": 4253
      },
      {
        "lageVasteKosten": "zonneplan",
        "lageOpslag": "tibber",
        "omslagpunt": 4440
      },
      {
        "lageVasteKosten": "vandebron",
        "lageOpslag": "anwb",
        "omslagpunt": 4485
      },
      {
        "lageVasteKosten": "liveenergy",
        "lageOpslag": "easyenergy",
        "omslagpunt": 4711
      },
      {
        "lageVasteKosten": "liveenergy",
        "lageOpslag": "anwb",
        "omslagpunt": 4781
      },
      {
        "lageVasteKosten": "easyenergy",
        "lageOpslag": "anwb",
        "omslagpunt": 4825
      },
      {
        "lageVasteKosten": "zonneplan",
        "lageOpslag": "frank",
        "omslagpunt": 4865
      },
      {
        "lageVasteKosten": "liveenergy",
        "lageOpslag": "vandebron",
        "omslagpunt": 5349
      },
      {
        "lageVasteKosten": "liveenergy",
        "lageOpslag": "zonopnaam",
        "omslagpunt": 5523
      },
      {
        "lageVasteKosten": "vandebron",
        "lageOpslag": "zonopnaam",
        "omslagpunt": 5697
      },
      {
        "lageVasteKosten": "easyenergy",
        "lageOpslag": "zonopnaam",
        "omslagpunt": 6606
      },
      {
        "lageVasteKosten": "energiedirect",
        "lageOpslag": "anwb",
        "omslagpunt": 7344
      },
      {
        "lageVasteKosten": "liveenergy",
        "lageOpslag": "eneco",
        "omslagpunt": 9268
      },
      {
        "lageVasteKosten": "liveenergy",
        "lageOpslag": "energyzero",
        "omslagpunt": 9775
      },
      {
        "lageVasteKosten": "liveenergy",
        "lageOpslag": "greenchoice",
        "omslagpunt": 9775
      },
      {
        "lageVasteKosten": "nextenergy",
        "lageOpslag": "anwb",
        "omslagpunt": 10120
      },
      {
        "lageVasteKosten": "eneco",
        "lageOpslag": "energyzero",
        "omslagpunt": 10909
      },
      {
        "lageVasteKosten": "eneco",
        "lageOpslag": "greenchoice",
        "omslagpunt": 10909
      },
      {
        "lageVasteKosten": "zonneplan",
        "lageOpslag": "anwb",
        "omslagpunt": 13620
      },
      {
        "lageVasteKosten": "energiek",
        "lageOpslag": "pure",
        "omslagpunt": 18718
      },
      {
        "lageVasteKosten": "energiedirect",
        "lageOpslag": "zonopnaam",
        "omslagpunt": 22636
      },
      {
        "lageVasteKosten": "nextenergy",
        "lageOpslag": "zonopnaam",
        "omslagpunt": 23295
      },
      {
        "lageVasteKosten": "nextenergy",
        "lageOpslag": "energiedirect",
        "omslagpunt": 24000
      },
      {
        "lageVasteKosten": "essent",
        "lageOpslag": "om",
        "omslagpunt": 46321
      },
      {
        "lageVasteKosten": "mega",
        "lageOpslag": "tibber",
        "omslagpunt": 75200
      },
      {
        "lageVasteKosten": "frank",
        "lageOpslag": "anwb",
        "omslagpunt": 121600
      },
      {
        "lageVasteKosten": "mega",
        "lageOpslag": "anwb",
        "omslagpunt": 197600
      },
      {
        "lageVasteKosten": "energiek",
        "lageOpslag": "tibber",
        "omslagpunt": 414138
      },
      {
        "lageVasteKosten": "zonneplan",
        "lageOpslag": "zonopnaam",
        "omslagpunt": 599714
      },
      {
        "lageVasteKosten": "energiek",
        "lageOpslag": "anwb",
        "omslagpunt": 1047241
      }
    ]
  },
  "gas": {
    "aantalLeveranciers": 20,
    "vastPerJaar": {
      "min": 65.88,
      "max": 117
    },
    "opslag": {
      "min": 0.05983,
      "max": 0.12979
    },
    "omslagpunt": 731,
    "goedkoopstePerVerbruik": [
      {
        "vanaf": 0,
        "tot": 399,
        "id": "energiedirect",
        "naam": "Energiedirect"
      },
      {
        "vanaf": 399,
        "tot": 69368,
        "id": "energiek",
        "naam": "Energiek"
      },
      {
        "vanaf": 69368,
        "tot": null,
        "id": "vandebron",
        "naam": "Vandebron"
      }
    ],
    "paren": [
      {
        "lageVasteKosten": "easyenergy",
        "lageOpslag": "energyzero",
        "omslagpunt": 109
      },
      {
        "lageVasteKosten": "easyenergy",
        "lageOpslag": "greenchoice",
        "omslagpunt": 109
      },
      {
        "lageVasteKosten": "easyenergy",
        "lageOpslag": "zonopnaam",
        "omslagpunt": 120
      },
      {
        "lageVasteKosten": "pure",
        "lageOpslag": "zonneplan",
        "omslagpunt": 126
      },
      {
        "lageVasteKosten": "pure",
        "lageOpslag": "powerpeers",
        "omslagpunt": 142
      },
      {
        "lageVasteKosten": "tibber",
        "lageOpslag": "liveenergy",
        "omslagpunt": 197
      },
      {
        "lageVasteKosten": "eneco",
        "lageOpslag": "energyzero",
        "omslagpunt": 202
      },
      {
        "lageVasteKosten": "eneco",
        "lageOpslag": "greenchoice",
        "omslagpunt": 202
      },
      {
        "lageVasteKosten": "eneco",
        "lageOpslag": "zonopnaam",
        "omslagpunt": 242
      },
      {
        "lageVasteKosten": "pure",
        "lageOpslag": "vandebron",
        "omslagpunt": 290
      },
      {
        "lageVasteKosten": "tibber",
        "lageOpslag": "zonneplan",
        "omslagpunt": 374
      },